id,title,severity,source,text
434,,,MITRE,"Unrestricted Upload of File with Dangerous Type. The product allows the upload or transfer of dangerous file types that are automatically processed within its environment.

::TYPE:Relationship:NOTE:This can have a chaining relationship with incomplete denylist / permissive allowlist errors when the product tries, but fails, to properly limit which types of files are allowed (CWE-183, CWE-184). This can also overlap multiple interpretation errors for intermediaries, e.g. anti-virus products that do not remove or quarantine attachments with certain file extensions that can be processed by client systems.:: Likelihood: ::PHASE:Implementation::PHASE:Architecture and Design:NOTE:OMISSION: This weakness is caused by missing a security tactic during the architecture and design phase.::. Consequences: ::SCOPE:Integrity:SCOPE:Confidentiality:SCOPE:Availability:IMPACT:Execute Unauthorized Code or Commands:NOTE:Arbitrary code execution is possible if an uploaded file is interpreted and executed as code by the recipient. This is especially true for web-server extensions such as .asp and .php because these file types are often treated as automatically executable, even when file system permissions do not specify execution. For example, in Unix environments, programs typically cannot run unless the execute bit is set, but PHP programs may be executed by the web server without directly invoking them on the operating system.::. Mitigations: ::PHASE:Architecture and Design:DESCRIPTION:Generate a new, unique filename for an uploaded file instead of using the user-supplied filename, so that no external input is used at all.[REF-422] [REF-423]::PHASE:Architecture and Design:STRATEGY:Enforcement by Conversion:DESCRIPTION:When the set of acceptable objects, such as filenames or URLs, is limited or known, create a mapping from a set of fixed input values (such as numeric IDs) to the actual filenames or URLs, and reject all other inputs.::PHASE:Architecture and Design:DESCRIPTION:Consider storing the uploaded files outside of the web document root entirely. Then, use other mechanisms to deliver the files dynamically. [REF-423]::PHASE:Implementation:STRATEGY:Input Validation:DESCRIPTION:Assume all input is malicious. Use an accept known good input validation strategy, i.e., use a list of acceptable inputs that strictly conform to specifications. Reject any input that does not strictly conform to specifications, or transform it into something that does. When performing input validation, consider all potentially relevant properties, including length, type of input, the full range of acceptable values, missing or extra inputs, syntax, consistency across related fields, and conformance to business rules. As an example of business rule logic, boat may be syntactically valid because it only contains alphanumeric characters, but it is not valid if the input is only expected to contain colors such as red or blue. Do not rely exclusively on looking for malicious or malformed inputs. This is likely to miss at least one undesirable input, especially if the code's environment changes. This can give attackers enough room to bypass the intended validation. However, denylists can be useful for detecting potential attacks or determining which inputs are so malformed that they should be rejected outright. For example, limiting filenames to alphanumeric characters can help to restrict the introduction of unintended file extensions.::PHASE:Architecture and Design:DESCRIPTION:Define a very limited set of allowable extensions and only generate filenames that end in these extensions. Consider the possibility of XSS (CWE-79) before allowing .html or .htm file types.::PHASE:Implementation:STRATEGY:Input Validation:DESCRIPTION:Ensure that only one extension is used in the filename. Some web servers, including some versions of Apache, may process files based on inner extensions so that filename.php.gif is fed to the PHP interpreter.[REF-422] [REF-423]::PHASE:Implementation:DESCRIPTION:When running on a web server that supports case-insensitive filenames, perform case-insensitive evaluations of the extensions that are provided.::PHASE:Architecture and Design:DESCRIPTION:For any security checks that are performed on the client side, ensure that these checks are duplicated on the server side, in order to avoid CWE-602. Attackers can bypass the client-side checks by modifying values after the checks have been performed, or by changing the client to remove the client-side checks entirely. Then, these modified values would be submitted to the server.::PHASE:Implementation:DESCRIPTION:Do not rely exclusively on sanity checks of file contents to ensure that the file is of the expected type and size. It may be possible for an attacker to hide code in some file segments that will still be executed by the server. For example, GIF images may contain a free-form comments field.::PHASE:Implementation:DESCRIPTION:Do not rely exclusively on the MIME content type or filename attribute when determining how to render a file. Validating the MIME content type and ensuring that it matches the extension is only a partial solution.::PHASE:Architecture and Design Operation:STRATEGY:Environment Hardening:DESCRIPTION:Run your code using the lowest privileges that are required to accomplish the necessary tasks [REF-76]. If possible, create isolated accounts with limited privileges that are only used for a single task. That way, a successful attack will not immediately give the attacker access to the rest of the software or its environment. For example, database applications rarely need to run as the database administrator, especially in day-to-day operations.::PHASE:Architecture and Design Operation:STRATEGY:Sandbox or Jail:DESCRIPTION:Run the code in a jail or similar sandbox environment that enforces strict boundaries between the process and the operating system. This may effectively restrict which files can be accessed in a particular directory or which commands can be executed by the software. OS-level examples include the Unix chroot jail, AppArmor, and SELinux. In general, managed code may provide some protection. For example, java.io.FilePermission in the Java SecurityManager allows the software to specify restrictions on file operations. This may not be a feasible solution, and it only limits the impact to the operating system; the rest of the application may still be subject to compromise. Be careful to avoid CWE-243 and other weaknesses related to jails.:EFFECTIVENESS:Limited::. Detection: ::METHOD:Dynamic Analysis with Automated Results Interpretation:DESCRIPTION:According to SOAR, the following detection techniques may be useful: Cost effective for partial coverage: Web Application Scanner Web Services Scanner Database Scanners:EFFECTIVENESS:SOAR Partial::METHOD:Dynamic Analysis with Manual Results Interpretation:DESCRIPTION:According to SOAR, the following detection techniques may be useful: Cost effective for partial coverage: Fuzz Tester Framework-based Fuzzer:EFFECTIVENESS:SOAR Partial::METHOD:Manual Static Analysis - Source Code:DESCRIPTION:According to SOAR, the following detection techniques may be useful: Highly cost effective: Focused Manual Spotcheck - Focused manual analysis of source Manual Source Code Review (not inspections):EFFECTIVENESS:High::METHOD:Automated Static Analysis - Source Code:DESCRIPTION:According to SOAR, the following detection techniques may be useful: Highly cost effective: Source code Weakness Analyzer Context-configured Source Code Weakness Analyzer:EFFECTIVENESS:High::METHOD:Architecture or Design Review:DESCRIPTION:According to SOAR, the following detection techniques may be useful: Highly cost effective: Formal Methods / Correct-By-Construction Cost effective for partial coverage: Inspection (IEEE 1028 standard) (can apply to requirements, design, source code, etc.):EFFECTIVENESS:High::. Examples: ::REFERENCE:CVE-2023-5227:DESCRIPTION:PHP-based FAQ management app does not check the MIME type for uploaded images:LINK:https://www.cve.org/CVERecord?id=CVE-2023-5227::REFERENCE:CVE-2001-0901:DESCRIPTION:Web-based mail product stores .shtml attachments that could contain SSI:LINK:https://www.cve.org/CVERecord?id=CVE-2001-0901::REFERENCE:CVE-2002-1841:DESCRIPTION:PHP upload does not restrict file types:LINK:https://www.cve.org/CVERecord?id=CVE-2002-1841::REFERENCE:CVE-2005-1868:DESCRIPTION:upload and execution of .php file:LINK:https://www.cve.org/CVERecord?id=CVE-2005-1868::REFERENCE:CVE-2005-1881:DESCRIPTION:upload file with dangerous extension:LINK:https://www.cve.org/CVERecord?id=CVE-2005-1881::REFERENCE:CVE-2005-0254:DESCRIPTION:program does not restrict file types:LINK:https://www.cve.org/CVERecord?id=CVE-2005-0254::REFERENCE:CVE-2004-2262:DESCRIPTION:improper type checking of uploaded files:LINK:https://www.cve.org/CVERecord?id=CVE-2004-2262::REFERENCE:CVE-2006-4558:DESCRIPTION:Double php extension leaves an active php extension in the generated filename.:LINK:https://www.cve.org/CVERecord?id=CVE-2006-4558::REFERENCE:CVE-2006-6994:DESCRIPTION:ASP program allows upload of .asp files by bypassing client-side checks:LINK:https://www.cve.org/CVERecord?id=CVE-2006-6994::REFERENCE:CVE-2005-3288:DESCRIPTION:ASP file upload:LINK:https://www.cve.org/CVERecord?id=CVE-2005-3288::REFERENCE:CVE-2006-2428:DESCRIPTION:ASP file upload:LINK:https://www.cve.org/CVERecord?id=CVE-2006-2428::"
476,,,MITRE,"NULL Pointer Dereference. The product dereferences a pointer that it expects to be valid but is NULL. Likelihood: ::PHASE:Implementation::. Consequences: ::SCOPE:Availability:IMPACT:DoS: Crash, Exit, or Restart:NOTE:NULL pointer dereferences usually result in the failure of the process unless exception handling (on some platforms) is available and implemented. Even when exception handling is being used, it can still be very difficult to return the software to a safe state of operation.::SCOPE:Integrity:SCOPE:Confidentiality:IMPACT:Execute Unauthorized Code or Commands:IMPACT:Read Memory:IMPACT:Modify Memory:NOTE:In rare circumstances, when NULL is equivalent to the 0x0 memory address and privileged code can access it, then writing or reading memory is possible, which may lead to code execution.::. Mitigations: ::PHASE:Implementation:DESCRIPTION:For any pointers that could have been modified or provided from a function that can return NULL, check the pointer for NULL before use. When working with a multithreaded or otherwise asynchronous environment, ensure that proper locking APIs are used to lock before the check, and unlock when it has finished.::PHASE:Requirements:DESCRIPTION:Select a programming language that is not susceptible to these issues.::PHASE:Implementation:DESCRIPTION:Check the results of all functions that return a value and verify that the value is non-null before acting upon it.:EFFECTIVENESS:Moderate::PHASE:Architecture and Design:DESCRIPTION:Identify all variables and data stores that receive information from external sources, and apply input validation to make sure that they are only initialized to expected values.::PHASE:Implementation:DESCRIPTION:Explicitly initialize all variables and other data stores, either during declaration or just before the first usage.::. Detection: ::METHOD:Automated Dynamic Analysis:DESCRIPTION:This weakness can be detected using dynamic tools and techniques that interact with the software using large test suites with many diverse inputs, such as fuzz testing (fuzzing), robustness testing, and fault injection. The software's operation may slow down, but it should not become unstable, crash, or generate incorrect results.:EFFECTIVENESS:Moderate::METHOD:Manual Dynamic Analysis:DESCRIPTION:Identify error conditions that are not likely to occur during normal usage and trigger them. For example, run the program under low memory conditions, run with insufficient privileges or permissions, interrupt a transaction before it is completed, or disable connectivity to basic network services such as DNS. Monitor the software for any unexpected behavior. If you trigger an unhandled exception or similar error that was discovered and handled by the application's environment, it may still indicate unexpected conditions that were not handled by the application itself.::METHOD:Automated Static Analysis:DESCRIPTION:Automated static analysis, commonly referred to as Static Application Security Testing (SAST), can find some instances of this weakness by analyzing source code (or binary/compiled code) without having to execute it. Typically, this is done by building a model of data flow and control flow, then searching for potentially-vulnerable patterns that connect sources (origins of input) with sinks (destinations where the data interacts with external components, a lower layer such as the OS, etc.):EFFECTIVENESS:High::. Examples: ::REFERENCE:CVE-2005-3274:DESCRIPTION:race condition causes a table to be corrupted if a timer activates while it is being modified, leading to resultant NULL dereference; also involves locking.:LINK:https://www.cve.org/CVERecord?id=CVE-2005-3274::REFERENCE:CVE-2002-1912:DESCRIPTION:large number of packets leads to NULL dereference:LINK:https://www.cve.org/CVERecord?id=CVE-2002-1912::REFERENCE:CVE-2005-0772:DESCRIPTION:packet with invalid error status value triggers NULL dereference:LINK:https://www.cve.org/CVERecord?id=CVE-2005-0772::REFERENCE:CVE-2009-4895:DESCRIPTION:Chain: race condition for an argument value, possibly resulting in NULL dereference:LINK:https://www.cve.org/CVERecord?id=CVE-2009-4895::REFERENCE:CVE-2020-29652:DESCRIPTION:ssh component for Go allows clients to cause a denial of service (nil pointer dereference) against SSH servers.:LINK:https://www.cve.org/CVERecord?id=CVE-2020-29652::REFERENCE:CVE-2009-2692:DESCRIPTION:Chain: Use of an unimplemented network socket operation pointing to an uninitialized handler function (CWE-456) causes a crash because of a null pointer dereference (CWE-476).:LINK:https://www.cve.org/CVERecord?id=CVE-2009-2692::REFERENCE:CVE-2009-3547:DESCRIPTION:Chain: race condition (CWE-362) might allow resource to be released before operating on it, leading to NULL dereference (CWE-476):LINK:https://www.cve.org/CVERecord?id=CVE-2009-3547::REFERENCE:CVE-2009-3620:DESCRIPTION:Chain: some unprivileged ioctls do not verify that a structure has been initialized before invocation, leading to NULL dereference:LINK:https://www.cve.org/CVERecord?id=CVE-2009-3620::REFERENCE:CVE-2009-2698:DESCRIPTION:Chain: IP and UDP layers each track the same value with different mechanisms that can get out of sync, possibly resulting in a NULL dereference:LINK:https://www.cve.org/CVERecord?id=CVE-2009-2698::REFERENCE:CVE-2009-2692:DESCRIPTION:Chain: uninitialized function pointers can be dereferenced allowing code execution:LINK:https://www.cve.org/CVERecord?id=CVE-2009-2692::REFERENCE:CVE-2009-0949:DESCRIPTION:Chain: improper initialization of memory can lead to NULL dereference:LINK:https://www.cve.org/CVERecord?id=CVE-2009-0949::REFERENCE:CVE-2008-3597:DESCRIPTION:Chain: game server can access player data structures before initialization has happened leading to NULL dereference:LINK:https://www.cve.org/CVERecord?id=CVE-2008-3597::REFERENCE:CVE-2020-6078:DESCRIPTION:Chain: The return value of a function returning a pointer is not checked for success (CWE-252) resulting in the later use of an uninitialized variable (CWE-456) and a null pointer dereference (CWE-476):LINK:https://www.cve.org/CVERecord?id=CVE-2020-6078::REFERENCE:CVE-2008-0062:DESCRIPTION:Chain: a message having an unknown message type may cause a reference to uninitialized memory resulting in a null pointer dereference (CWE-476) or dangling pointer (CWE-825), possibly crashing the system or causing heap corruption.:LINK:https://www.cve.org/CVERecord?id=CVE-2008-0062::REFERENCE:CVE-2008-5183:DESCRIPTION:Chain: unchecked return value can lead to NULL dereference:LINK:https://www.cve.org/CVERecord?id=CVE-2008-5183::REFERENCE:CVE-2004-0079:DESCRIPTION:SSL software allows remote attackers to cause a denial of service (crash) via a crafted SSL/TLS handshake that triggers a null dereference.:LINK:https://www.cve.org/CVERecord?id=CVE-2004-0079::REFERENCE:CVE-2004-0365:DESCRIPTION:Network monitor allows remote attackers to cause a denial of service (crash) via a malformed RADIUS packet that triggers a null dereference.:LINK:https://www.cve.org/CVERecord?id=CVE-2004-0365::REFERENCE:CVE-2003-1013:DESCRIPTION:Network monitor allows remote attackers to cause a denial of service (crash) via a malformed Q.931, which triggers a null dereference.:LINK:https://www.cve.org/CVERecord?id=CVE-2003-1013::REFERENCE:CVE-2003-1000:DESCRIPTION:Chat client allows remote attackers to cause a denial of service (crash) via a passive DCC request with an invalid ID number, which causes a null dereference.:LINK:https://www.cve.org/CVERecord?id=CVE-2003-1000::REFERENCE:CVE-2004-0389:DESCRIPTION:Server allows remote attackers to cause a denial of service (crash) via malformed requests that trigger a null dereference.:LINK:https://www.cve.org/CVERecord?id=CVE-2004-0389::REFERENCE:CVE-2004-0119:DESCRIPTION:OS allows remote attackers to cause a denial of service (crash from null dereference) or execute arbitrary code via a crafted request during authentication protocol selection.:LINK:https://www.cve.org/CVERecord?id=CVE-2004-0119::REFERENCE:CVE-2004-0458:DESCRIPTION:Game allows remote attackers to cause a denial of service (server crash) via a missing argument, which triggers a null pointer dereference.:LINK:https://www.cve.org/CVERecord?id=CVE-2004-0458::REFERENCE:CVE-2002-0401:DESCRIPTION:Network monitor allows remote attackers to cause a denial of service (crash) or execute arbitrary code via malformed packets that cause a NULL pointer dereference.:LINK:https://www.cve.org/CVERecord?id=CVE-2002-0401::REFERENCE:CVE-2001-1559:DESCRIPTION:Chain: System call returns wrong value (CWE-393), leading to a resultant NULL dereference (CWE-476).:LINK:https://www.cve.org/CVERecord?id=CVE-2001-1559::"
502,,,MITRE,"Deserialization of Untrusted Data. The product deserializes untrusted data without sufficiently ensuring that the resulting data will be valid.
::Serialization and deserialization refer to the process of taking program-internal object-related data, packaging it in a way that allows the data to be externally stored or transferred (serialization), then extracting the serialized data to reconstruct the original object (deserialization).::
::TYPE:Maintenance:NOTE:The relationships between CWE-502 and CWE-915 need further exploration. CWE-915 is more narrowly scoped to object modification, and is not necessarily used for deserialization.:: Likelihood: ::PHASE:Architecture and Design:NOTE:OMISSION: This weakness is caused by missing a security tactic during the architecture and design phase.::PHASE:Implementation::. Consequences: ::SCOPE:Integrity:IMPACT:Modify Application Data:IMPACT:Unexpected State:NOTE:Attackers can modify unexpected objects or data that was assumed to be safe from modification. Deserialized data or code could be modified without using the provided accessor functions, or unexpected functions could be invoked.::SCOPE:Availability:IMPACT:DoS: Resource Consumption (CPU):NOTE:If a function is making an assumption on when to terminate, based on a sentry in a string, it could easily never terminate.::SCOPE:Other:IMPACT:Varies by Context:NOTE:The consequences can vary widely, because it depends on which objects or methods are being deserialized, and how they are used. Making an assumption that the code in the deserialized object is valid is dangerous and can enable exploitation. One example is attackers using gadget chains to perform unauthorized actions, such as generating a shell.::. Mitigations: ::PHASE:Architecture and Design Implementation:DESCRIPTION:If available, use the signing/sealing features of the programming language to assure that deserialized data has not been tainted. For example, a hash-based message authentication code (HMAC) could be used to ensure that data has not been modified.::PHASE:Implementation:DESCRIPTION:When deserializing data, populate a new object rather than just deserializing. The result is that the data flows through safe input validation and that the functions are safe.::PHASE:Implementation:DESCRIPTION:Explicitly define a final object() to prevent deserialization.::PHASE:Architecture and Design Implementation:DESCRIPTION:Make fields transient to protect them from deserialization. An attempt to serialize and then deserialize a class containing transient fields will result in NULLs where the transient data should be. This is an excellent way to prevent time, environment-based, or sensitive variables from being carried over and used improperly.::PHASE:Implementation:DESCRIPTION:Avoid having unnecessary types or gadgets (a sequence of instances and method invocations that can self-execute during the deserialization process, often found in libraries) available that can be leveraged for malicious ends. This limits the potential for unintended or unauthorized types and gadgets to be leveraged by the attacker. Add only acceptable classes to an allowlist. Note: new gadgets are constantly being discovered, so this alone is not a sufficient mitigation.::PHASE:Architecture and Design Implementation:DESCRIPTION:Employ cryptography of the data or code for protection. However, it's important to note that it would still be client-side security. This is risky because if the client is compromised then the security implemented on the client (the cryptography) can be bypassed.::. Detection: ::METHOD:Automated Static Analysis:DESCRIPTION:Automated static analysis, commonly referred to as Static Application Security Testing (SAST), can find some instances of this weakness by analyzing source code (or binary/compiled code) without having to execute it. Typically, this is done by building a model of data flow and control flow, then searching for potentially-vulnerable patterns that connect sources (origins of input) with sinks (destinations where the data interacts with external components, a lower layer such as the OS, etc.):EFFECTIVENESS:High::. Examples: ::REFERENCE:CVE-2019-12799:DESCRIPTION:chain: bypass of untrusted deserialization issue (CWE-502) by using an assumed-trusted class (CWE-183):LINK:https://www.cve.org/CVERecord?id=CVE-2019-12799::REFERENCE:CVE-2015-8103:DESCRIPTION:Deserialization issue in commonly-used Java library allows remote execution.:LINK:https://www.cve.org/CVERecord?id=CVE-2015-8103::REFERENCE:CVE-2015-4852:DESCRIPTION:Deserialization issue in commonly-used Java library allows remote execution.:LINK:https://www.cve.org/CVERecord?id=CVE-2015-4852::REFERENCE:CVE-2013-1465:DESCRIPTION:Use of PHP unserialize function on untrusted input allows attacker to modify application configuration.:LINK:https://www.cve.org/CVERecord?id=CVE-2013-1465::REFERENCE:CVE-2012-3527:DESCRIPTION:Use of PHP unserialize function on untrusted input in content management system might allow code execution.:LINK:https://www.cve.org/CVERecord?id=CVE-2012-3527::REFERENCE:CVE-2012-0911:DESCRIPTION:Use of PHP unserialize function on untrusted input in content management system allows code execution using a crafted cookie value.:LINK:https://www.cve.org/CVERecord?id=CVE-2012-0911::REFERENCE:CVE-2012-0911:DESCRIPTION:Content management system written in PHP allows unserialize of arbitrary objects, possibly allowing code execution.:LINK:https://www.cve.org/CVERecord?id=CVE-2012-0911::REFERENCE:CVE-2011-2520:DESCRIPTION:Python script allows local users to execute code via pickled data.:LINK:https://www.cve.org/CVERecord?id=CVE-2011-2520::REFERENCE:CVE-2012-4406:DESCRIPTION:Unsafe deserialization using pickle in a Python script.:LINK:https://www.cve.org/CVERecord?id=CVE-2012-4406::REFERENCE:CVE-2003-0791:DESCRIPTION:Web browser allows execution of native methods via a crafted string to a JavaScript function that deserializes the string.:LINK:https://www.cve.org/CVERecord?id=CVE-2003-0791::"
